nodeId	pmid	pmcid	np	head	base	type	term	coid	section	arg_type
8b63b9112e74d3872570247e9ee3a958	23172735	PMC4226405	core afucosylation	afucosylation	core afucosylation	glycosylation	afucosylation	COID653555	RESULTS	arg0
faf907b6b0d74d8fa58f6773fd7d6e2a	23172735	PMC4226405	an antibody	antibody	an antibody	antibody	antibody	COID278523	RESULTS	arg1
18c0c840b75411075fd3ab81cb7cbffb	23172735	PMC4226405	samples from various stages of the antibody purification procedure to demonstrate efficient removal of potential process-related contaminants	samples	samples	antibody	antibody	COID278523	RESULTS	arg0
d8628283bf0c5e02c7189936a0270195	23172735	PMC4226405	siRNA	siRNA	FUT8 and GMD siRNA and transfection lipid concentrations	NYK	siRNA	COID416464	RESULTS	arg1
25f021502adaca02d6d4742af5daa095	23172735	PMC4226405	antibody	antibody	antibody	antibody	antibody	COID278523	RESULTS	arg1
76937be412897cd6d3ad2244da0b70c6	23172735	PMC4226405	growth profiles for all conditions	profiles	growth profiles	cell culture parameters	growth	COID203666	RESULTS	arg0
84a6a84c199901df3df419e5e3f39a9e	23172735	PMC4226405	maximum cell concentration occurring on day 9	concentration	maximum cell concentration	process parameters or process control	cell concentration	COID623648	RESULTS	arg1
11227a14f40e6f512566c08a9bd46fc4	25042542	PMC4282109	The continued need to improve therapeutic recombinant protein productivity	need	The continued need to improve therapeutic recombinant protein productivity	recombinant protein	recombinant protein	COID593158	ABSTRACT	arg0
9f7bfa04414fd06a2b91aa0930c617ca	25042542	PMC4282109	therapeutic recombinant protein productivity	productivity	therapeutic recombinant protein productivity	process condition	productivity	COID731421	ABSTRACT	arg1
70c1cf5b21ef73ed941a98e510310c2b	25042542	PMC4282109	The continued need to improve therapeutic recombinant protein productivity	need	The continued need to improve therapeutic recombinant protein productivity	process condition	productivity	COID731421	ABSTRACT	arg0
f9952213191e120fedf8d8d3a7d40e38	25042542	PMC4282109	therapeutic recombinant protein productivity	productivity	therapeutic recombinant protein productivity	recombinant protein	recombinant protein	COID593158	ABSTRACT	arg1
3fbbabd400b739ab73c300baf2eb6546	25042542	PMC4282109	cell cycle arrest by directly	arrest	cell cycle arrest	biological process	cell cycle	COID780295	ABSTRACT	arg0
960db23fb06240280f51d97792d0d3fb	25042542	PMC4282109	CDK4/6 using selective inhibitor compound	CDK4/6	CDK4/6	secondary raw materials	inhibitor	COID760391	ABSTRACT	arg1
8b109d7a2f0fb965d7916ec9abfa9f1b	25042542	PMC4282109	a selective and complete cell cycle G0/G1 arrest	arrest	a selective and complete cell cycle G0/G1 arrest	cell cycle pathway G0/G1/M/G2	G0/G1 arrest	COID007895	RESULTS	arg0
c7de5a1188fe8a58a01ff40b19b34fc9	25042542	PMC4282109	CDK4/6 functions	functions	CDK4/6 functions	process condition	functions	COID532355	RESULTS	arg1
b6905a1b1e8c3f9fbd98a4c69bb2fa9e	25042542	PMC4282109	a selective and complete cell cycle G0/G1 arrest	arrest	a selective and complete cell cycle G0/G1 arrest	biological process	cell cycle	COID780295	RESULTS	arg0
3e937c33afd111e69057a2ec1e39ff34	25042542	PMC4282109	genes involved in the cell cycle pathway	genes	genes	genotype	genes	COID185502	RESULTS	arg0
4367670b28f3ec321aeb3cfb9ba28cf1	25042542	PMC4282109	the cell cycle pathway	pathway	the cell cycle pathway	biological process	cell cycle	COID780295	RESULTS	arg1
eb8da884c9ff621702640ad47b28b832	25042542	PMC4282109	Genes that are involved in glyco-protein quality control	Genes	Genes	genotype	Genes	COID185502	RESULTS	arg0
105e6031b5c5aefe6b5d171c2ecc71e8	25042542	PMC4282109	glyco-protein quality control	control	glyco-protein quality control	product quality attributes	quality	COID109463	RESULTS	arg1
28ffd7a536eb87209e93dd8dcccedf5e	25042542	PMC4282109	multiple recombinant cell lines which produce mAbs with different glycan profiles	lines	multiple recombinant cell lines	cell line	cell lines	COID702829	RESULTS	arg0
c6468b9bc902032760cca694da69b0be	25042542	PMC4282109	mAbs with different glycan profiles	mAbs	mAbs	monoclonal antibody	mAbs	COID242255	RESULTS	arg1
cdbf3c0ff14ec42d274dd43146ae0468	25042542	PMC4282109	30 C-temperature shift condition	condition	30 C-temperature shift condition	bioreactor conditions	temperature	COID692615	RESULTS	arg0
9c10972ed5af9172df5a3ca81afb7d5b	25042542	PMC4282109	Antibody produced from 30 C-temperature shift condition	Antibody	Antibody	antibody	Antibody	COID278523	RESULTS	arg1
2808996aa97197a8ef2a7847895490a8	25042542	PMC4282109	modulation of glycosylation pathway genes	modulation	modulation	glycosylation	glycosylation	COID119643	RESULTS	arg0
2580f1ea6eaa044f2f14aca55f88d2e9	25042542	PMC4282109	metabolism homeostasis	homeostasis	metabolism homeostasis	biological process	metabolism	COID291079	RESULTS	arg1
5782bcda6b8d6380c04a400a34eb779a	25042542	PMC4282109	modulation of glycosylation pathway genes	modulation	modulation	genotype	genes	COID185502	RESULTS	arg0
db03f194c7d92ec9803508393b918ba8	25042542	PMC4282109	a program that favors recombinant protein secretion, assembly and glycosylation modification	program	a program	recombinant protein	recombinant protein	COID593158	RESULTS	arg1
10e46dce21c941530f24827612110371	25042542	PMC4282109	a program that favors recombinant protein secretion, assembly and glycosylation modification	program	a program	glycosylation	glycosylation	COID119643	RESULTS	arg1
24f23718a1050767f8dcca22488bebe1	25042542	PMC4282109	the cell cycle pathway	pathway	the cell cycle pathway	biological process	cell cycle	COID780295	RESULTS	arg0
67cecbe3215c57293820f83b4b45d910	25042542	PMC4282109	genes involved in the cell cycle pathway	genes	genes	genotype	genes	COID185502	RESULTS	arg1
4fbacc16c31bcad62ced4189ba5131e6	25042542	PMC4282109	G0/G1 arrest	arrest	G0/G1 arrest	cell cycle pathway G0/G1/M/G2	G0/G1 arrest	COID007895	RESULTS	arg0
28e27d33b0e85401c5ac76d7db5aa325	25042542	PMC4282109	glycan processing	processing	glycan processing	sugar (subset of carbon source)	glycan	COID626759	RESULTS	arg1
6267978d658864447cc7d6f8ac1c5ce1	25042542	PMC4282109	a Complete G0/G1 Arrest	Arrest	a Complete G0/G1 Arrest	cell cycle pathway G0/G1/M/G2	G0/G1 Arrest	COID007895	RESULTS	arg0
e1087085d6caa78c1cade1990c0f7981	25042542	PMC4282109	N-Linked Glycosylation Maturation	Maturation	N-Linked Glycosylation Maturation	glycosylation	N-Linked Glycosylation	COID005169	RESULTS	arg1
bb1c4a47fccbbf145330639e18754237	25042542	PMC4282109	decreasing culture temperature	temperature	decreasing culture temperature	bioreactor conditions	temperature	COID692615	RESULTS	arg0
1c197e0c07d20190513d65b5788ae043	25042542	PMC4282109	qP	qP	qP	flux rate	qP	COID599783	RESULTS	arg1
69e078b9583802314cd4a3f4fd4f62ef	25042542	PMC4282109	nutrient-limitation	nutrient-limitation	nutrient-limitation	secondary raw materials	nutrient	COID423902	RESULTS	arg0
40b66af749d12cdf524fb4d54fd5ae38	25042542	PMC4282109	lower cultivation temperature	temperature	lower cultivation temperature	bioreactor conditions	temperature	COID692615	RESULTS	arg0
5d2131dce0dc7ade26a87c597caa0110	25042542	PMC4282109	mAb assembly	assembly	mAb assembly	monoclonal antibody	mAb	COID242255	RESULTS	arg1
d4426fef01ae9e81727a7742e4d94431	25042542	PMC4282109	the phenotypic changes observed in production reactors and product quality	changes	the phenotypic changes	product quality attributes	product quality	COID111751	RESULTS	arg0
0b935096c81822c90e7a7a7f833f113d	25042542	PMC4282109	changes in gene expression	changes	changes	genotype	gene	COID185502	RESULTS	arg1
523e8dc9939ef6071e0793aa8fe5354c	25042542	PMC4282109	a 30 C-temperature shift (<7 x 107/mL)	shift	a 30 C-temperature shift	bioreactor conditions	temperature	COID692615	RESULTS	arg0
c3e72b107a804595763ac0e3cece374c	25042542	PMC4282109	cell growth	growth	cell growth	cell culture parameters	cell growth	COID093598	RESULTS	arg1
9e007cd4a30c392d59c2dcf04361c8f5	25042542	PMC4282109	CDK4/6 inhibitor	inhibitor	CDK4/6 inhibitor	secondary raw materials	inhibitor	COID760391	RESULTS	arg0
385b1e8668910feced5a604d3a0d2bad	25042542	PMC4282109	fewer changes in the cell cycle pathway	changes	fewer changes	biological process	cell cycle	COID780295	RESULTS	arg0
f70be992007556f85c7e926a17501031	25042542	PMC4282109	temperature shift	shift	temperature shift	bioreactor conditions	temperature	COID692615	RESULTS	arg1
ded53584b61a91426728e6d6b8af3211	25042542	PMC4282109	Use of a small molecule cell cycle inhibitor	Use	Use	biological process	cell cycle	COID780295	TITLE	arg0
f9a18068d5d4a6b0111ddb0e955bb912	25042542	PMC4282109	product quality	quality	product quality	product quality attributes	product quality	COID111751	TITLE	arg1
a82249eff3051ab194f72e77fdb75239	25042542	PMC4282109	Use of a small molecule cell cycle inhibitor	Use	Use	secondary raw materials	inhibitor	COID760391	TITLE	arg0
7d41acfceef7aca05db6a7f14bb3b9bc	25042542	PMC4282109	specific productivity	productivity	specific productivity	process condition	specific productivity	COID731421	TITLE	arg1
5131e6ab46b07935edc5e6b26d7f1f92	25042542	PMC4282109	cell growth	growth	cell growth	cell culture parameters	cell growth	COID093598	TITLE	arg1
b43321758341dff346823104c07afeac	25641927	PMC4492121	CHO	CHO	CHO	chinese hamster ovary (CHO)	CHO	COID806780	ABSTRACT	arg0
cf2264bc8c89350a9e7fdb588b1cf852	25641927	PMC4492121	Recombinant glycoproteins produced in Chinese hamster overy (CHO) only	glycoproteins	Recombinant glycoproteins	product	glycoproteins	COID866322	ABSTRACT	arg1
3d571e7aa54d0dcd8b640549d12d11c0	25641927	PMC4492121	Chinese hamster overy (CHO) only	overy	Chinese hamster overy	chinese hamster ovary (CHO)	CHO	COID806780	ABSTRACT	arg0
48bf61e739c889b9ece1cf5d13db0e5e	25641927	PMC4492121	the enriched ST6GAL1 Clone 27	Clone	the enriched ST6GAL1 Clone 27	enzyme	ST6GAL1	COID749247	ABSTRACT	arg0
5ba2e381c91da6d3a01860faf6e71bca	25641927	PMC4492121	IgG produced by the enriched ST6GAL1 Clone 27	IgG	IgG	antibody	IgG	COID713543	ABSTRACT	arg1
388422cf0b2452b1792e45253f643211	25641927	PMC4492121	this host cell line	line	this host cell line	cell line	host cell line	COID702829	ABSTRACT	arg0
db80725d8a23866ea0a8fba18f2e3fe8	25641927	PMC4492121	The recombinant IgG expressed in this host cell line	IgG	The recombinant IgG	antibody	IgG	COID713543	ABSTRACT	arg1
2cfad538773b59ee1ef59405b0d22cbf	25641927	PMC4492121	The recombinant IgG expressed in this host cell line	IgG	The recombinant IgG	antibody	IgG	COID713543	ABSTRACT	arg0
64c709a110742b5ee0661893d10e05cf	25641927	PMC4492121	alpha2,6-linked SA	SA	alpha2,6-linked SA	sugar (subset of carbon source)	SA	COID148212	ABSTRACT	arg1
374af7fa580d7573c4f37c70b604d283	25641927	PMC4492121	ST6GAL1_OE_32 host cell line	line	ST6GAL1_OE_32 host cell line	cell line	host cell line	COID702829	RESULTS	arg0
fdb0f8d29fb89b08d2d7eb712d57a147	25641927	PMC4492121	The IgG produced in ST6GAL1_OE_32 host cell line	IgG	The IgG	antibody	IgG	COID713543	RESULTS	arg1
c3c4cfd94b04954ad4a21624384f5609	25641927	PMC4492121	both ST6GAL1 stable pools	pools	both ST6GAL1 stable pools	enzyme	ST6GAL1	COID749247	RESULTS	arg0
37b48686cb6a136541359aac7a59b85e	25641927	PMC4492121	the IgG produced in both ST6GAL1 stable pools	IgG	the IgG	antibody	IgG	COID713543	RESULTS	arg1
80bdde85a2c29cc6c8b42d1305e11776	25641927	PMC4492121	IgG produced in ST6GAL1_OE_32 host cell line	IgG	IgG	antibody	IgG	COID713543	RESULTS	arg1
6958329cefb7f4066ebd22a3a414ca04	25641927	PMC4492121	two transfections using ST6GAL1_OE_32 host cell line	transfections	two transfections	cell line	host cell line	COID702829	RESULTS	arg0
252c2f67affddb5344a818cb12a37708	25641927	PMC4492121	the two IgG stable pools derived from two transfections using ST6GAL1_OE_32 host cell line	pools	the two IgG stable pools	antibody	IgG	COID713543	RESULTS	arg1
60218e825bab5bbbd0304fe8d71cd49e	25641927	PMC4492121	Clone 27 St6gal1 OE	OE	Clone 27 St6gal1 OE	enzyme	St6gal1	COID749247	RESULTS	arg0
91ab8878a70e9aa4efd64a79f7d9511a	25641927	PMC4492121	IgG produced by Clone 27 St6gal1 OE and the nontransfected control (Supporting Information Figure 2)	IgG	IgG	antibody	IgG	COID713543	RESULTS	arg1
dac4a498b892bcf727737656b2cd66f9	25641927	PMC4492121	IgG produced in both ST6GAL1 stable pools	IgG	IgG	antibody	IgG	COID713543	RESULTS	arg1
09e37855e838fa58a3ca0a2c0b45388b	25641927	PMC4492121	CHOZN GS host cell line (Figure 9C)	line	CHOZN GS host cell line	cell line	host cell line	COID702829	RESULTS	arg0
4588ab4d4c9e11b2c96695582a234bad	25641927	PMC4492121	the control IgG stable pools derived from CHOZN GS host cell line (Figure 9C)	pools	the control IgG stable pools	antibody	IgG	COID713543	RESULTS	arg1
6e7c22951c0b4ca6ca454d58327598bf	25641927	PMC4492121	St3gal6	St3gal6	St3gal6	enzyme	St3gal6	COID373234	RESULTS	arg0
f5e8d29b2d47d1b191eaaa09cc39db8d	25641927	PMC4492121	sialyltransferase	sialyltransferase	sialyltransferase	enzyme	sialyltransferase	COID191824	RESULTS	arg1
f4811559020b5090f0a6ed3ead42e1c4	25641927	PMC4492121	ST6GAL1_OE_31	ST6GAL1_OE_31	ST6GAL1_OE_31	enzyme	ST6GAL1_OE_31	COID749247	RESULTS	arg0
35fd216199d0b075cb64bfab32e4b227	25641927	PMC4492121	several populations that cannot be confirmed to have alpha2,6-linked sialic acid (Figure 8)	populations	several populations	sugar (subset of carbon source)	sialic acid	COID148212	RESULTS	arg1
c4aed60e796b062a8ff50cae01dd35df	25641927	PMC4492121	higher relative content alpha2,6-linked sialylated glycans	glycans	higher relative content alpha2,6-linked sialylated glycans	sugar (subset of carbon source)	sialylated glycans	COID113402	RESULTS	arg0
21658667d5f0e32f9eef2a811d042842	25641927	PMC4492121	ST6GAL1_OE_31	ST6GAL1_OE_31	ST6GAL1_OE_31	enzyme	ST6GAL1_OE_31	COID749247	RESULTS	arg1
80461fc00b566c99fe2196f82f9beea3	25641927	PMC4492121	Chinese Hamster Ovary (CHO) Host Cell Engineering	Engineering	Chinese Hamster Ovary (CHO) Host Cell Engineering	chinese hamster ovary (CHO)	Chinese Hamster Ovary	COID806780	TITLE	arg0
75c9a66980e89642e121104b020a19de	25641927	PMC4492121	Sialyltransferase Expression	Expression	Sialyltransferase Expression	enzyme	Sialyltransferase	COID191824	TITLE	arg1
04519aec6b77f3f1ec05081cd4a65699	25641927	PMC4492121	Chinese Hamster Ovary (CHO) Host Cell Engineering	Engineering	Chinese Hamster Ovary (CHO) Host Cell Engineering	chinese hamster ovary (CHO)	CHO	COID806780	TITLE	arg0
55cfeb986850434452809ed6281e730c	25875452	PMC4622614	sialyl-transferases	sialyl-transferases	sialyl-transferases	enzyme	sialyl-transferases	COID191824	ABSTRACT	arg0
e839eb8abc5369ed1ec13102e884330b	25875452	PMC4622614	the limited sialylation level in the wild-type IgG1 expressed alone or with GT	level	the limited sialylation level	glycosylation	sialylation	COID543327	ABSTRACT	arg1
8aef5d6c7fcbbaa20b37892489126544	25875452	PMC4622614	the glycan interaction with Fc's amino acid residues	interaction	the glycan interaction	sugar (subset of carbon source)	glycan	COID626759	ABSTRACT	arg0
c1113dffad1ee5324ea02f4afee80a25	25875452	PMC4622614	alpha2,6-sialylated glycans in both antibodies	glycans	alpha2,6-sialylated glycans	sugar (subset of carbon source)	sialylated glycans	COID113402	ABSTRACT	arg0
10828af087478b6cc0019e09960a3e48	25875452	PMC4622614	glycoprofile	glycoprofile	glycoprofile	product attributes	glycoprofile	COID135698	ABSTRACT	arg1
05e12459acdb9394560d3e1a55208369	25875452	PMC4622614	The presence of alpha2,6-sialic acids on the Fc N-glycan	presence	The presence	sugar (subset of carbon source)	N-glycan	COID216687	ABSTRACT	arg0
c3d8a63fb6089cf97feb39677bb26521	25875452	PMC4622614	anti-inflammatory properties	properties	anti-inflammatory properties	product attributes	anti-inflammatory properties	COID592241	ABSTRACT	arg1
daadf1f2bcc9a52cfbdb028e9cd76cfe	25875452	PMC4622614	digestion with the alpha2,3SA-specific sialidase S from Streptococcus pneumoniae or the non-specific sialidase A from Arthrobacter ureafaciens	digestion	digestion	enzyme	sialidase	COID070440	RESULTS	arg0
8cf989a6b6cf00501f10c0294ddfcc76	25875452	PMC4622614	The SA linkage types in the glycans	types	The SA linkage types	sugar (subset of carbon source)	SA	COID148212	RESULTS	arg1
b9a2b582729fd155d1cde1c152086f12	25875452	PMC4622614	co-expression of glycosyltransferases	co-expression	co-expression	enzyme	glycosyltransferases	COID225633	RESULTS	arg0
ac2661e663dc4aadf89e888b12816ef2	25875452	PMC4622614	TZM glycoprofiles	glycoprofiles	TZM glycoprofiles	product attributes	glycoprofiles	COID135698	RESULTS	arg1
9dbcdedc1f17086918c64b3bf2b729b0	26910040	PMC4947490	a cell culture process	process	a cell culture process	cell culture parameters	cell culture	COID293414	ABSTRACT	arg0
eddf4be6be19bfc0658ea66d049b306f	26910040	PMC4947490	a monoclonal antibody (mAb)	antibody	a monoclonal antibody	monoclonal antibody	monoclonal antibody	COID242255	ABSTRACT	arg1
9378f0a12d15299978096d90ad872b6a	26910040	PMC4947490	cell respiration	respiration	cell respiration	metabolic pathways	cell respiration	COID898929	ABSTRACT	arg0
3a85fa22b901c25e4f0bd596e40fecaf	26910040	PMC4947490	the deprivation of tyrosine	deprivation	the deprivation	media parameter or raw material	tyrosine	COID500516	ABSTRACT	arg1
fd039b6039456f9baf7e2af27c2d2ce3	26910040	PMC4947490	mAb	mAb	mAb	monoclonal antibody	mAb	COID242255	ABSTRACT	arg1
7cd686eac6a2fead7c2d720cebae39d8	26910040	PMC4947490	the specific productivity in the qP low experiments	productivity	the specific productivity	process condition	specific productivity	COID731421	RESULTS	arg0
cd6cb675918490988be89604efb671a1	26910040	PMC4947490	a pH-dependent behavior	behavior	a pH-dependent behavior	bioreactor conditions	pH	COID893209	RESULTS	arg1
9878f131fa9baef08fe94743e536084d	26910040	PMC4947490	pH	pH	pH	bioreactor conditions	pH	COID893209	RESULTS	arg0
f1ee293a98fdd5dca4ca88d16fc5a345	26910040	PMC4947490	monoclonal antibody (mAb) glycosylation	glycosylation	monoclonal antibody (mAb) glycosylation	monoclonal antibody	monoclonal antibody	COID242255	RESULTS	arg1
714882c51c1519eb2aea2ea83ba68d92	26910040	PMC4947490	monoclonal antibody (mAb) glycosylation	glycosylation	monoclonal antibody (mAb) glycosylation	glycosylation	glycosylation	COID119643	RESULTS	arg1
eb388d9e4d0cc8410ed3013d1133263b	26910040	PMC4947490	monoclonal antibody (mAb) glycosylation	glycosylation	monoclonal antibody (mAb) glycosylation	monoclonal antibody	mAb	COID242255	RESULTS	arg1
9d80d8df4a1cab4dbaf1f0fc842eb716	26910040	PMC4947490	nutrient limitation	limitation	nutrient limitation	secondary raw materials	nutrient	COID423902	RESULTS	arg0
90c144253f61ca95ac5c74aefe4aa552	26910040	PMC4947490	lactate metabolism	metabolism	lactate metabolism	biological process	metabolism	COID291079	RESULTS	arg1
ce92d6c50301d9af0ce3174681742e71	26910040	PMC4947490	lactate metabolism	metabolism	lactate metabolism	by-product or waste	lactate	COID250920	RESULTS	arg1
8da6465a2a82baaa94943b0c2fbca295	26910040	PMC4947490	product formation in our system of interest	formation	product formation	flux rate	product formation	COID187355	RESULTS	arg0
440f0d0a4be41b74ba70627186f43e41	26910040	PMC4947490	cell respiration	respiration	cell respiration	metabolic pathways	cell respiration	COID898929	RESULTS	arg1
75f4de519ff7170c1ef8693d0cb6fc0e	26910040	PMC4947490	the rate of product formation in our system of interest	rate	the rate	flux rate	product formation	COID187355	RESULTS	arg0
24bd13a77af18dd9b8309c9eeaa08671	26910040	PMC4947490	the differences in qP patterns	differences	the differences	flux rate	qP	COID599783	RESULTS	arg0
7c196f3d4ad8d035a479e608720df67c	26910040	PMC4947490	differences in product quality	differences	differences	product quality attributes	product quality	COID111751	RESULTS	arg1
8818c19efba4e46039f4d6d85b140f72	26910040	PMC4947490	the feeding rate in the cultivations without pH shift	rate	the feeding rate	bioreactor conditions	pH	COID893209	RESULTS	arg0
8f4fb11461dec3aad6880caa5d87d9d2	26910040	PMC4947490	the metabolic shift to lactate consumption	shift	the metabolic shift	by-product or waste	lactate	COID250920	RESULTS	arg1
0cbfd5076e31bc8bf1ba41a99b7fbf7f	26910040	PMC4947490	the cultivations without pH shift	cultivations	the cultivations	bioreactor conditions	pH	COID893209	RESULTS	arg0
586a1af02c4b516c4de2562b9eefff9e	26910040	PMC4947490	several time points of the cultivations	points	several time points	process parameters or process control	time	COID742277	RESULTS	arg0
8de53c6360ab46b38ba70ecdca182fed	26910040	PMC4947490	An important CQA	CQA	An important CQA	product quality attributes	CQA	COID162607	RESULTS	arg1
9c6abbc95b6b5232d0644ce2111b567b	26910040	PMC4947490	product glycosylation	glycosylation	product glycosylation	glycosylation	glycosylation	COID119643	RESULTS	arg1
0eb456e3e02db40363f6f25fd0336ac2	26910040	PMC4947490	The relationship of respiratory activity and specific productivity	relationship	The relationship	process condition	specific productivity	COID731421	RESULTS	arg0
2bedd4dc72f96bc0d8fc23fb35dafe7f	26910040	PMC4947490	a pH-dependent pattern (Fig. 7d)	pattern	a pH-dependent pattern	bioreactor conditions	pH	COID893209	RESULTS	arg1
2d15c45ea171e3921602d8205c11303e	26910040	PMC4947490	high mannose content	content	high mannose content	sugar (subset of carbon source)	high mannose	COID981337	RESULTS	arg0
8f39077c857a398e9eb94aeafc153938	26910040	PMC4947490	specific productivity	productivity	specific productivity	process condition	specific productivity	COID731421	RESULTS	arg1
9688b6b727b0130245000c01e22d87a0	26910040	PMC4947490	the exhaustion of tyrosine	exhaustion	the exhaustion	media parameter or raw material	tyrosine	COID500516	RESULTS	arg0
7139c85de76d64a1579ba923bb83f61e	26910040	PMC4947490	qP	qP	qP	flux rate	qP	COID599783	RESULTS	arg1
fc7d782ed280da4c24ce506020cc937a	26910040	PMC4947490	the high amount of new product molecules at high qP	amount	the high amount	flux rate	qP	COID599783	RESULTS	arg0
3d6f0c3f48730b922732ca3d853a583e	26910040	PMC4947490	the distribution of glycoforms in the respective samples	distribution	the distribution	recombinant protein	glycoforms	COID288767	RESULTS	arg1
bfd53d6609c2c90ddd0ef0d3cee3c204	26910040	PMC4947490	product formation	formation	product formation	flux rate	product formation	COID187355	RESULTS	arg0
1b5f49dacb923cb5afe9c904f4014de5	26910040	PMC4947490	the rate of product formation	rate	the rate	flux rate	product formation	COID187355	RESULTS	arg0
be090f476933876b96d5dfc2c33a6449	26910040	PMC4947490	the increase of qP	increase	the increase	flux rate	qP	COID599783	RESULTS	arg0
e4e5f63f863088b3df63cc34c682fd9b	26910040	PMC4947490	the accumulation of pre-mature glycoforms	accumulation	the accumulation	recombinant protein	glycoforms	COID288767	RESULTS	arg1
104fd7c6428bdd783d53480ca2f6c006	26910040	PMC4947490	the setpoint of the pH shift	setpoint	the setpoint	bioreactor conditions	pH	COID893209	RESULTS	arg0
c9688eb0802cf583bf95627cbb1b328b	26910040	PMC4947490	osmolality profiles	profiles	osmolality profiles	process parameters or process control	osmolality	COID710653	RESULTS	arg1
d9812d8c08d078a986cc54aa274fa00b	26910040	PMC4947490	pH shift	shift	pH shift	bioreactor conditions	pH	COID893209	RESULTS	arg0
a844f605f3cd5c240127b571fff67888	26910040	PMC4947490	the relationship between qO2 and qP	relationship	the relationship	flux rate	qP	COID599783	RESULTS	arg1
db2bd782f8d9b6eba3bdbdabc66d78f1	26910040	PMC4947490	the bolus-fed cultivations	cultivations	the bolus-fed cultivations	process parameters or process control	bolus	COID693522	RESULTS	arg1
b53ac97add3bc5aa50bd13975f10a9af	26910040	PMC4947490	the first decrease in OUR	decrease	the first decrease	biological process	OUR	COID844361	RESULTS	arg0
4da7fef1d20261d02a7053ed84c4f687	26910040	PMC4947490	the cultivations with cell line B (day 7)	cultivations	the cultivations	cell line	cell line	COID702829	RESULTS	arg1
829df049a2fd98095a0735ef009e96ae	26910040	PMC4947490	the cell line A cultures (day 8)	cultures	the cell line A cultures	cell line	cell line	COID702829	RESULTS	arg1
32bf4bed8efefe457ca20f765ce2e6fc	27559765	PMC5098448	Chinese hamster ovary cells	cells	Chinese hamster ovary cells	chinese hamster ovary (CHO)	Chinese hamster ovary cells	COID806780	ABSTRACT	arg0
70c2f1665c4c5a1e4fc03c8b095664c8	27559765	PMC5098448	a recombinant antibody produced in Chinese hamster ovary cells	antibody	a recombinant antibody	antibody	antibody	COID278523	ABSTRACT	arg1
d4c3d0303a5660cabac2c61a98c2ad32	27559765	PMC5098448	the chimeric anti-GD2 antibody	antibody	the chimeric anti-GD2 antibody	antibody	chimeric anti-GD2 antibody	COID593142	ABSTRACT	arg1
8ff4486ac455f48a0ffbddb64da98ca7	27559765	PMC5098448	structural stability	stability	structural stability	process condition	stability	COID548988	ABSTRACT	arg0
d712b355912a4e47a3ed16afaeaa498b	27559765	PMC5098448	individual charge variant fractions by nano differential scanning calorimetry	fractions	individual charge variant fractions	product quality profile	charge variant	COID817650	ABSTRACT	arg1
4ff4e82e95d7ed96bc082d5984f65cdd	27559765	PMC5098448	sialylation content	content	sialylation content	glycosylation	sialylation	COID543327	RESULTS	arg0
47674a242f80672b4eb96eb1512872cb	27559765	PMC5098448	antibody in-vitro efficacy	efficacy	antibody in-vitro efficacy	clinical outcomes	efficacy	COID912630	RESULTS	arg1
a7b63f91f02a9987f7eb09cbe2830a7e	27559765	PMC5098448	antibody in-vitro efficacy	efficacy	antibody in-vitro efficacy	antibody	antibody	COID278523	RESULTS	arg1
902e79ea933d4d1b529d1d126df18ebd	27559765	PMC5098448	temperature	temperature	temperature	bioreactor conditions	temperature	COID692615	RESULTS	arg0
3ea3a240b96909d3707a37464e78c562	27559765	PMC5098448	the microheterogeneity pattern of a protein solution	pattern	the microheterogeneity pattern	clinical outcomes	microheterogeneity	COID021590	RESULTS	arg1
de8a694d5beb70a27d8fbb82e4d2bd2b	27559765	PMC5098448	Oxidation of methionine and tryptophan residues by itself	Oxidation	Oxidation	PTM	Oxidation	COID907585	RESULTS	arg0
