nodeId	pmid	pmcid	np	head	base	type	term	coid	section	arg_type
37cfa1e077370cde58d9692e1dd344b4	31544815	PMC6640710	IgG core fucosylation	fucosylation	IgG core fucosylation	antibody	IgG	COID713543	RESULTS	arg1
86252e993daf458d2f46cb9f34a4e5ed	31544815	PMC6640710	5-AlkFuc compared to 2F-Fuc	5-AlkFuc	5-AlkFuc	sugar (subset of carbon source)	5-AlkFuc	COID256307	RESULTS	arg0
a4db4534f59b5563b9025b5cde2b8bd4	31544815	PMC6640710	the IgG fucosylation	fucosylation	the IgG fucosylation	glycosylation	fucosylation	COID810570	RESULTS	arg1
f474fca938f5eadba741e9cdb8de8665	31544815	PMC6640710	the IgG fucosylation	fucosylation	the IgG fucosylation	antibody	IgG	COID713543	RESULTS	arg1
d04b447346d08640abf9014551895ee3	31544815	PMC6640710	The reduction of core fucosylation in the Fc-part of antibodies	reduction	The reduction	glycosylation	core fucosylation	COID663555	RESULTS	arg0
a5f3bb47c3da4db97baa4fe27fbf0e28	31544815	PMC6640710	enhanced ADCC	ADCC	enhanced ADCC	clinical outcomes	ADCC	COID386333	RESULTS	arg1
932bf4036a49565585d78e1f8f2f329a	31544815	PMC6640710	increasing inhibitor concentrations	concentrations	increasing inhibitor concentrations	secondary raw materials	inhibitor	COID760391	RESULTS	arg0
6e6ecb1d8ea2c63e3424fe85f984e276	31544815	PMC6640710	the impact of peracetylation	impact	the impact	PTM	peracetylation	COID113739	RESULTS	arg1
e441d155c42cd1d0a6cdc7542f6defd6	31544815	PMC6640710	all fucose analogues	analogues	all fucose analogues	substitution material	fucose analogues	COID400862	RESULTS	arg0
8e43a09c7060c9fb39790f4facd72131	31544815	PMC6640710	total fucosylation	fucosylation	total fucosylation	glycosylation	fucosylation	COID810570	RESULTS	arg1
26f94bad871b60a39f86ad2fba2c43f3	33476097	PMC8365702	mAb-1	mAb-1	mAb-1	monoclonal antibody	mAb-1	COID268135	RESULTS	arg0
981b2109d83523b1627f70541602ec2e	33476097	PMC8365702	the lowest binding free energy to HEXB compared to other antibodies	energy	the lowest binding free energy	antibody	antibodies	COID278523	RESULTS	arg1
e3cee3c6fd4bdf90d25c41b2c2ad6110	33656168	PMC8451748	the maximum possible yield	yield	the maximum possible yield	overall titer or batch yield	yield	COID809703	RESULTS	arg1
440a2fb9bb15fba97a9d2d58f159c09b	33656168	PMC8451748	cellular growth	growth	cellular growth	cell culture parameters	growth	COID203666	RESULTS	arg1
e370aeb0f517468942b9ffae86e15594	33738790	PMC8453549	the IgG titer on Day 14	titer	the IgG titer	overall titer or batch yield	IgG titer	COID814559	RESULTS	arg0
0a15bcc601022e189215a62f1ac34efc	33738790	PMC8453549	the condition where 8.5 g/L lactate was spiked on Day 7	condition	the condition	by-product or waste	lactate	COID250920	RESULTS	arg1
57cb3d8cdc909ab3c93e2bcfc171714e	33742789	PMC8459231	usage of FC as iron source in CCM	usage	usage	trace metals or minerals (subset of secondary raw materials)	iron	COID094956	RESULTS	arg0
b4f2e18d5e121720452b7f155af62099	33742789	PMC8459231	a lower cell growth	growth	a lower cell growth	cell culture parameters	cell growth	COID093598	RESULTS	arg1
8601d8b728c1c31bee5084ef877d4b06	33742789	PMC8459231	time	time	time	process parameters or process control	time	COID742277	RESULTS	arg0
ab560dfa55ad9d73b565e5cc2dbf90ed	33742789	PMC8459231	iron concentration	concentration	iron concentration	trace metals or minerals (subset of secondary raw materials)	iron	COID094956	RESULTS	arg1
09f939afc36151ad3edd1f727d596e4e	33742789	PMC8459231	iron concentration	concentration	iron concentration	trace metals or minerals (subset of secondary raw materials)	iron	COID094956	RESULTS	arg0
e1810f047e3d72117178c74d531fb050	33742789	PMC8459231	terminal sialylation level	level	terminal sialylation level	glycosylation	sialylation	COID543327	RESULTS	arg1
260cd3c2199da1d60d761d33e469e36c	33742789	PMC8459231	an increase in iron concentration	increase	an increase	trace metals or minerals (subset of secondary raw materials)	iron	COID094956	RESULTS	arg0
f919998fce32a5ef7990d470f9ae5d9a	33742789	PMC8459231	a faster decrease in viability (Figure 1b)	decrease	a faster decrease	process parameters or process control	viability	COID222142	RESULTS	arg1
afd0d9beef57bce69bc754fac433194d	33804825	PMC8037477	Feed C supplementation	supplementation	Feed C supplementation	secondary raw materials	supplementation	COID566710	ABSTRACT	arg0
3568b1c5edc04def4a7a746058b803d1	33804825	PMC8037477	a significant reduction in galactosylated antibody structures	reduction	a significant reduction	antibody	antibody	COID278523	ABSTRACT	arg1
e224b8af4907149f87d6d72a5a6386bf	33804825	PMC8037477	increased intracellular pH conditions that inhibit b4GalT activity and expression, and consequently lead to reduced protein galactosylation	conditions	increased intracellular pH conditions	bioreactor conditions	pH	COID893209	RESULTS	arg0
382640fcb90191eaa4f01af6c2c4b306	33804825	PMC8037477	b4GalT activity	activity	b4GalT activity	enzyme	b4GalT	COID856080	RESULTS	arg1
b7f36afda19b051476003868d7e2e342	33804825	PMC8037477	reduced protein galactosylation	galactosylation	reduced protein galactosylation	glycosylation	galactosylation	COID475750	RESULTS	arg1
3933d6d5f56feaf84770aa53c716208c	33804825	PMC8037477	the highest osmolality condition (500 mOsm kg-1 Feed C)	condition	the highest osmolality condition	process parameters or process control	osmolality	COID710653	RESULTS	arg0
da2810a10db1965e7e3b6f8f957ada9e	33804825	PMC8037477	significantly lower levels of core fucosylation	levels	significantly lower levels	glycosylation	core fucosylation	COID663555	RESULTS	arg1
7fb8ad6cc0ceba040bcac0f114b6e15c	34542245	PMC9286570	butyric acid (BA)	acid	butyric acid	acid (subset of secondary raw materials)	butyric acid	COID365093	ABSTRACT	arg0
6d4f186e278543152f997dba27d73859	34542245	PMC9286570	cell growth	growth	cell growth	cell culture parameters	cell growth	COID093598	ABSTRACT	arg1
c3d7a0c01a35b6f173c9b47e28c79f80	34542245	PMC9286570	BA	BA	BA	acid (subset of secondary raw materials)	BA	COID365093	ABSTRACT	arg0
3244e5f899e91bd7f0101d58db0f23c1	34542245	PMC9286570	these reduced viabilities	viabilities	these reduced viabilities	process parameters or process control	viabilities	COID222142	RESULTS	arg0
ec5238175e8aaf6fc8ce62e509227616	34542245	PMC9286570	higher process impurities	impurities	higher process impurities	process condition	impurities	COID901557	RESULTS	arg1
e0958cbe67fed0a283bd40b560bd35f1	34575094	PMC8469772	substrate concentration	concentration	substrate concentration	substrates	substrate	COID265919	RESULTS	arg0
01c5de5a04e519ec1fb4b4709a1a75e6	34575094	PMC8469772	the production of metabolic byproducts (lactate and NH4+)	production	the production	by-product or waste	metabolic byproducts	COID531384	RESULTS	arg1
5f8f4f0db930794f3519e763ef2d9648	34575094	PMC8469772	the production of metabolic byproducts (lactate and NH4+)	production	the production	by-product or waste	lactate	COID250920	RESULTS	arg1
fe114c6f3fb57ff47a1f30eeed4a0ed4	34575094	PMC8469772	the fed-batch process	process	the fed-batch process	process mode	fed-batch	COID529446	RESULTS	arg0
00b7a09e0a966954d6d39ad5834dfc91	34575094	PMC8469772	the disadvantages of low production efficiency and easy accumulation of metabolic byproducts	disadvantages	the disadvantages	by-product or waste	metabolic byproducts	COID531384	RESULTS	arg1
4c1a823e8f3b2879774f73b9ba341cf3	34575094	PMC8469772	cell line A	A	cell line A	cell line	cell line	COID702829	RESULTS	arg0
512efbb626b1a90d88bcb37820e8cce1	34575094	PMC8469772	lower lactate and NH4+ levels	levels	lower lactate and NH4+ levels	by-product or waste	lactate	COID250920	RESULTS	arg1
1754218dd0e3d8f98aa9409e2adb7d14	34575094	PMC8469772	a lower osmolality	osmolality	a lower osmolality	process parameters or process control	osmolality	COID710653	RESULTS	arg0
cd7fa3c7f82d6315ed414e6bf873fcb4	34575094	PMC8469772	a lower high-mannose glycoform content	content	a lower high-mannose glycoform content	recombinant protein	high-mannose glycoform	COID965734	RESULTS	arg1
a7bda55a26ba72c9c94f996cb0b78ff9	35441833	PMC9542549	the fastest growing cell line tested	line	the fastest growing cell line	cell line	cell line	COID702829	ABSTRACT	arg0
a5bb5aac6bff1ca1e1a963615060ba3a	35441833	PMC9542549	a 35% decrease in cell growth and product titre	decrease	a 35% decrease	cell culture parameters	cell growth	COID093598	ABSTRACT	arg1
9da902d4a1eca0024df434215a704af9	35441833	PMC9542549	DOT-fluctuated vessels	vessels	DOT-fluctuated vessels	vessel or process parameter or production scale	DOT-fluctuated vessels	COID853468	RESULTS	arg0
009358e7522e0be9ed4ac2fe8df15499	35441833	PMC9542549	decreased levels of G0F and elevated G1F + G2F glycans	levels	decreased levels	sugar (subset of carbon source)	G2F glycans	COID847130	RESULTS	arg1
c6a308f419c0a15f53814cda2c187ea7	35441833	PMC9542549	decreased levels of G0F and elevated G1F + G2F glycans	levels	decreased levels	sugar (subset of carbon source)	G0F	COID847830	RESULTS	arg1
40b68ad12bbebaa6e03c3509fcac4a49	35441833	PMC9542549	decreased levels of G0F and elevated G1F + G2F glycans	levels	decreased levels	sugar (subset of carbon source)	G1F	COID847930	RESULTS	arg1
a79a8969f2b15ac5165aee22a341f65b	35441833	PMC9542549	the lower DOT cultures The agreement between the findings of our small-scale studies (15 ml) and these larger scale studies (>3 L) supports the use of the miniature bioreactor platform for studying the response of different cell lines to culture heterogeneities	cultures	the lower DOT cultures The agreement between the findings of our small-scale studies (15 ml) and these larger scale studies (>3 L) supports the use of the miniature bioreactor platform for studying the response of different cell lines to culture heterogeneities	vessel or process parameter or production scale	bioreactor	COID345693	RESULTS	arg0
14acdbe40b68d7f15b8b238472a7ecdf	35441833	PMC9542549	increased glycolysis	glycolysis	increased glycolysis	metabolic pathways	glycolysis	COID345655	RESULTS	arg1
26121e7fc953e174a0c3711f0334ffd4	35441833	PMC9542549	the lower DOT cultures The agreement between the findings of our small-scale studies (15 ml) and these larger scale studies (>3 L) supports the use of the miniature bioreactor platform for studying the response of different cell lines to culture heterogeneities	cultures	the lower DOT cultures The agreement between the findings of our small-scale studies (15 ml) and these larger scale studies (>3 L) supports the use of the miniature bioreactor platform for studying the response of different cell lines to culture heterogeneities	vessel or process parameter or production scale	scale	COID586187	RESULTS	arg0
00288799d746d7be1c4f9722cdb8c8ef	35441833	PMC9542549	12% lower levels of G1F + G2F	levels	12% lower levels	sugar (subset of carbon source)	G1F	COID847930	RESULTS	arg1
6811038bc196c8c90f679839db3b0d86	35441833	PMC9542549	12% lower levels of G1F + G2F	levels	12% lower levels	sugar (subset of carbon source)	G2F	COID847130	RESULTS	arg1
0ec488ba82de1ec58838e4574952cfd2	35441833	PMC9542549	drop pH	pH	drop pH	bioreactor conditions	pH	COID893209	RESULTS	arg1
124d9f81220f4946ba2dc78300f1bc43	35441833	PMC9542549	DO-fluctuated cultures	cultures	DO-fluctuated cultures	bioreactor conditions	DO	COID661988	RESULTS	arg0
3793b2f908caa7d1aa9ff82b264be9ab	35441833	PMC9542549	lower peak VCD values	values	lower peak VCD values	cell culture parameters	VCD	COID384695	RESULTS	arg1
91aa3d8b9357bc65ed35b1132640cabf	35441833	PMC9542549	the overall lower (30%) DOT	DOT	the overall lower (30%) DOT	NYK	DOT	COID003597	RESULTS	arg0
66153ce339fae5b6273c00db77950f7e	35441833	PMC9542549	the increased lactate accumulation	accumulation	the increased lactate accumulation	by-product or waste	lactate	COID250920	RESULTS	arg1
e9ce5361cd3028e7f5f2ac1316c8226b	35441833	PMC9542549	DOT-fluctuated cultures	cultures	DOT-fluctuated cultures	NYK	DOT	COID003597	RESULTS	arg0
0adc7e8ef76c7e307847df83ce12fe55	35441833	PMC9542549	peak antibody titres between 2.5 and 3.1 gl-1; significantly lower than controls (p value <0.05)	titres	peak antibody titres	antibody	antibody	COID278523	RESULTS	arg1
96409750b0ad6616ee66c261c0a61ccf	35441833	PMC9542549	a 35% decrease in growth	decrease	a 35% decrease	cell culture parameters	growth	COID203666	RESULTS	arg1
eda621f05d7fc7f3803b000115fb1e68	35441833	PMC9542549	the oxygen consumption rate of the cells	rate	the oxygen consumption rate	gases (subset of secondary raw materials)	oxygen	COID472476	RESULTS	arg0
f9426d8e263a56074e469f720b3f2620	35441833	PMC9542549	the DOT to drop even quicker	DOT	the DOT	NYK	DOT	COID003597	RESULTS	arg1
f382524b0f6655a2dd6aaf8201844bd3	35441833	PMC9542549	Man5 levels	levels	Man5 levels	sugar (subset of carbon source)	Man5	COID568402	RESULTS	arg0
0e4dbdcae6d8c8f48d6519fea92e38f0	35441833	PMC9542549	pH-fluctuated vessels	vessels	pH-fluctuated vessels	vessel or process parameter or production scale	pH-fluctuated vessels	COID322748	RESULTS	arg1
41cdc15b90a1426612d02fcdd4dc15e2	35441833	PMC9542549	pH-fluctuated vessels	vessels	pH-fluctuated vessels	vessel or process parameter or production scale	pH-fluctuated vessels	COID322748	RESULTS	arg0
e8a90a74e9ac49d9da610adbc7fa5da4	35441833	PMC9542549	Man5 levels	levels	Man5 levels	sugar (subset of carbon source)	Man5	COID568402	RESULTS	arg1
a5879ddb3dc313d26c98fe1db75fa233	35441833	PMC9542549	growth	growth	slightly lower growth and product titre	cell culture parameters	growth	COID203666	RESULTS	arg0
201155b883efcc35a491486675c58174	35441833	PMC9542549	The 60 min pH fluctuations	fluctuations	The 60 min pH fluctuations	bioreactor conditions	pH	COID893209	RESULTS	arg1
800e4c76aab4080f55a44cf780b45d39	35737825	PMC9235890	Cell death in bioreactors	death	Cell death	vessel or process parameter or production scale	bioreactors	COID345693	ABSTRACT	arg0
5e6f7d9cb8f31550c2ba2505277247d0	35737825	PMC9235890	productivity	productivity	productivity	process condition	productivity	COID731421	ABSTRACT	arg1
334c315a0cc4f284dccb8add7a3e94f2	35737825	PMC9235890	the death-resistant cell lines	lines	the death-resistant cell lines	cell line	death-resistant cell lines	COID434844	ABSTRACT	arg0
e213929a92990e90c01cd93974585fb1	35737825	PMC9235890	slower drops in viability	drops	slower drops	process parameters or process control	viability	COID222142	ABSTRACT	arg1
d8080e8b12d2fa69e01a3695b90c688c	35737825	PMC9235890	The perfusion process	process	The perfusion process	process mode	perfusion	COID329168	RESULTS	arg0
882b11ca886f3f101ff10326d3b92b05	35737825	PMC9235890	ammonium concentrations	concentrations	ammonium concentrations	culture condition	ammonium	COID714150	RESULTS	arg1
c9fd8031224ee01d5e0a77d66b318818	37456731	PMC10349264	low media usage	usage	low media usage	media characteristics	media	COID913636	RESULTS	arg0
5689a77065f26c0b2aa0d7ae5c06a6be	37456731	PMC10349264	increased peak cell densities known from perfusion cultures and low media usage as in a fed batch operation	densities	increased peak cell densities	cell culture parameters	cell densities	COID283414	RESULTS	arg1
94888dee2eb530c1ba0504af4011d743	37456731	PMC10349264	the time course	course	the time course	process parameters or process control	time	COID742277	RESULTS	arg0
a614a7635a8ac0cc96bad6832f9acf4a	37456731	PMC10349264	specific growth rate	rate	specific growth rate	cell culture parameters	growth rate	COID957002	RESULTS	arg1
f7de96b52de96da955455daa65a22d6a	37456731	PMC10349264	viability	viability	viability	process parameters or process control	viability	COID222142	RESULTS	arg1
304398a750b7518ab19ebea70fc522fa	37456731	PMC10349264	cell densities	densities	cell densities	cell culture parameters	cell densities	COID283414	RESULTS	arg0
1b9557b4c82e512b80adedabca61a552	37456731	PMC10349264	the perfusion process	process	the perfusion process	process mode	perfusion	COID329168	RESULTS	arg1
def6dacc3a335df13b9ccfa0f1155da3	37731040	PMC10511539	Overexpressing cGNTIII in mammalian cells	cGNTIII	Overexpressing cGNTIII	genotype	cGNTIII	COID316428	RESULTS	arg0
e7e23621cb45df1a931a213cfadae279	37731040	PMC10511539	antibodies with bisecting glycan structures and reduced fucose content	antibodies	antibodies	antibody	antibodies	COID278523	RESULTS	arg1
2df1c5dfc52ee8f277deb9878372b0cb	37731040	PMC10511539	The qP	qP	The qP	flux rate	qP	COID599783	RESULTS	arg0
31b6b4ff3149bc2304fe2ec719ed8053	37731040	PMC10511539	cGNTIII gene	gene	cGNTIII gene	genotype	cGNTIII gene	COID316428	RESULTS	arg1
cf94018dc2f7309c670a70fa28dc019f	37731040	PMC10511539	high-level overexpression of cGNTIII	overexpression	high-level overexpression	genotype	cGNTIII	COID316428	RESULTS	arg0
195e98a980865e0ff4c12f3efba81a3a	37731040	PMC10511539	a reduction in the galactosylation level of IgG1s (Fig. 4F)	reduction	a reduction	glycosylation	galactosylation	COID475750	RESULTS	arg1
bc4b9c4309412f330a26bb0af44a76c7	chapter_11	978-1-4987-6285-4	the dissolution of nitrogen into water	dissolution	the dissolution	gases (subset of secondary raw materials)	nitrogen	COID546348	CHAPTER 11	arg0
fce0d8df331af343cb5fe4d3fa65979b	chapter_11	978-1-4987-6285-4	the transfer of oxygen	transfer	the transfer	gases (subset of secondary raw materials)	oxygen	COID472476	CHAPTER 11	arg1
509783219c0b29409a1a675e160a2399	chapter_12	978-1-4987-6285-4	the aeration rate that is used to control the dissolved oxygen level	aeration	the aeration rate	bioreactor conditions	aeration	COID371755	CHAPTER 12	arg0
f90ff95d5d6a1c99d66dfcb1295a9e7e	chapter_12	978-1-4987-6285-4	the dissolved oxygen level	level	the dissolved oxygen level	bioreactor conditions	dissolved oxygen	COID661988	CHAPTER 12	arg1
c840487ed8880cdbfef2d5c8e21c0a07	chapter_2	978-1-4987-6285-4	the completely folded protein with an N-glycan that does not have any terminal glucose	protein	the completely folded protein	sugar (subset of carbon source)	N-glycan	COID216687	CHAPTER 2	arg0
40298820b7111e1101c3db2faca80341	chapter_2	978-1-4987-6285-4	any terminal glucose	glucose	any terminal glucose	sugar (subset of carbon source)	glucose	COID367406	CHAPTER 2	arg1
f52f49ad51b211304234e4c1769c9f21	chapter_3_2	978-1-4987-6285-4	IgG molecules that do not have a fucose on their mannose core	molecules	IgG molecules	antibody	IgG	COID713543	CHAPTER 3	arg0
7a5849dc7f02a90409279f4cefc6996c	chapter_3_2	978-1-4987-6285-4	a fucose on their mannose core	fucose	a fucose	sugar (subset of carbon source)	fucose	COID275575	CHAPTER 3	arg1
1a8d88f3310d090976957f72a1baf495	chapter_3_2	978-1-4987-6285-4	a greater than 10-fold higher ADCC activity	activity	a greater than 10-fold higher ADCC activity	clinical outcomes	ADCC	COID386333	CHAPTER 3	arg1
73fd8d456857a3452bde36446c66fe95	chapter_4	978-1-4987-6285-4	A process parameter that does not impact a CQA but may affect process consistency	parameter	A process parameter	process parameters or process control	process parameter	COID163282	CHAPTER 4	arg0
3e8bbfe1f841d9313d19d92587855368	chapter_4	978-1-4987-6285-4	a CQA	CQA	a CQA	product quality attributes	CQA	COID162607	CHAPTER 4	arg1
e10ae44f1c485bdb039841bf0b6fc16a	11150551		sodium butyrate	butyrate	sodium butyrate	secondary raw materials	butyrate	COID702790	ABSTRACT	arg0
86d12d1ce4d4a52a40fdc0d51640eef2	11150551		glycosylation	glycosylation	glycosylation	glycosylation	glycosylation	COID119643	ABSTRACT	arg1
06e8ad42399c577ee98e975ccddbd5c8	11150551		the presence of butyrate	presence	the presence	secondary raw materials	butyrate	COID702790	ABSTRACT	arg0
2e79b20dc548fe9e6710955b57784a92	11150551		The glycoform profile of each antibody produced	antibody	each antibody	product attributes	glycoform profile	COID912805	ABSTRACT	arg1
8b8b800f07527d9a7e5751f86e56bdec	24326352		the glycosylation patterns of monomeric, dimeric, and large aggregated forms of the antibody	patterns	the glycosylation patterns	product attributes	glycosylation patterns	COID857544	ABSTRACT	arg0
555852c7b07c74468f28f16817c3aa9b	24326352		monomeric, dimeric, and large aggregated forms of the antibody	forms	monomeric, dimeric, and large aggregated forms	product quality attributes	large aggregated	COID879651	ABSTRACT	arg1
0425cff798d3b7d53e5a46a1f3e6835d	25931375		addition of up to 40 mM galactose	addition	addition	sugar (subset of carbon source)	galactose	COID770311	ABSTRACT	arg0
510fef5462addd077310737c647ef835	25931375		Cell culture performance	performance	Cell culture performance	product quality attributes	Cell culture performance	COID284912	ABSTRACT	arg1
c83ba7e1051d6d13eaa8ee7a588afc53	26587969		Glycation	Glycation	Glycation	glycosylation	Glycation	COID274291	ABSTRACT	arg0
5d9439e0096bd16f65105a300ee5547d	26587969		the historical bolus glucose feeding regimen	regimen	the historical bolus glucose feeding regimen	sugar (subset of carbon source)	glucose	COID367406	ABSTRACT	arg1
35ceb1e48538b195779dd938504d3ac5	26587969		the historical bolus glucose feeding regimen	regimen	the historical bolus glucose feeding regimen	process parameters or process control	bolus	COID693522	ABSTRACT	arg1
bef26a3bc1d92d39e67b4f03f5836d46	26587969		the historical bolus glucose feeding regimen	regimen	the historical bolus glucose feeding regimen	sugar (subset of carbon source)	glucose	COID367406	ABSTRACT	arg0
3991d25866d357b091dacc3ca83966dc	26587969		Glycation	Glycation	Glycation	glycosylation	Glycation	COID274291	ABSTRACT	arg1
9fd810a1625bf7e2aae3fed04860ef94	26587969		the historical bolus glucose feeding regimen	regimen	the historical bolus glucose feeding regimen	process parameters or process control	bolus	COID693522	ABSTRACT	arg0
29d9de4eb0214d2e3afd14ac990aeced	27453130		the process conditions	conditions	the process conditions	process condition	process conditions	COID106153	ABSTRACT	arg0
9c51b160d32379408e756d1318ef757e	27453130		Volumetric recombinant antibody yields	yields	Volumetric recombinant antibody yields	overall titer or batch yield	Volumetric recombinant antibody yields	COID088953	ABSTRACT	arg1
54748a6c0bf1f5b719f1b76e78583554	29673624		cell productivity (less than 10%)	productivity	cell productivity	process condition	productivity	COID731421	ABSTRACT	arg1
5efc91c1558db911a041e8c9b5e2b651	29885096		The use of disposable vessels to minimize stainless steel surface exposure to the cell culture	use	The use	vessel or process parameter or production scale	disposable vessels	COID795419	ABSTRACT	arg0
c7a5414edea008217053334c032abfe1	29885096		comparable terminal galactosylation levels to those measured in pilot and commercial bioreactors	levels	comparable terminal galactosylation levels	glycosylation	galactosylation	COID475750	ABSTRACT	arg1
cc9d388cc9aa7681a14a8ed65c4361e1	29923054		pCO2	pCO2	pCO2	process condition	pCO2	COID255565	ABSTRACT	arg0
81e93a3446b566bb871c51abf8a843b1	29923054		the monoclonal antibody (mAb) N-glycosylation profile in Chinese hamster ovary (CHO) cell culture	profile	the monoclonal antibody (mAb) N-glycosylation profile	product attributes	N-glycosylation profile	COID683283	ABSTRACT	arg1
3d78aacf2ee3545ed462886e29995609	23172735	PMC4226405	siRNA transfection into cells grown in shake flasks	transfection	siRNA transfection	NYK	siRNA	COID416464	RESULTS	arg0
ebf707f1af7ecfc49bb2b903c7160574	23172735	PMC4226405	cell growth characteristics	characteristics	cell growth characteristics	cell culture parameters	cell growth	COID093598	RESULTS	arg1
829ac5b92924dbefe0bfd44f8dae7133	23172735	PMC4226405	protein productivity	productivity	protein productivity	process condition	productivity	COID731421	RESULTS	arg1
a8ff90b2ae20d4419039301322e63363	23172735	PMC4226405	siRNA addition	addition	siRNA addition	NYK	siRNA	COID416464	RESULTS	arg0
c7431ec9bd7d30bd879c547e9b192088	23172735	PMC4226405	growth	growth	growth	cell culture parameters	growth	COID203666	RESULTS	arg1
aa37433be9033d8e80a54a8f8833212c	25042542	PMC4282109	A selective Cdk4/6 inhibitor	inhibitor	A selective Cdk4/6 inhibitor	secondary raw materials	inhibitor	COID760391	RESULTS	arg0
5c3b8ccdbba6b5b18fd44e1321a7550a	25042542	PMC4282109	other phases of the cell cycle in which cells should continue to progress and eventually decline in number	phases	other phases	biological process	cell cycle	COID780295	RESULTS	arg1
cf29b83e649c5cac8d1f004857078473	25875452	PMC4622614	Fc glycan	glycan	Fc glycan	sugar (subset of carbon source)	glycan	COID626759	RESULTS	arg0
eede499c1be609d56002ad39a864beb9	25875452	PMC4622614	the basic and acidic variants	variants	the basic and acidic variants	acid (subset of secondary raw materials)	acidic variants	COID106814	RESULTS	arg1
908ec50c5fb1c44b2af33380a26bb5c8	25875452	PMC4622614	this increased galactosylation	galactosylation	this increased galactosylation	glycosylation	galactosylation	COID475750	RESULTS	arg0
4a45829a670a5cf4dd849b28f10e3043	25875452	PMC4622614	a higher sialylation	sialylation	a higher sialylation	glycosylation	sialylation	COID543327	RESULTS	arg1
d6f70b4a434b2491ec7b7d4bcd706bbe	27559765	PMC5098448	High-mannose type glycans	glycans	High-mannose type glycans	sugar (subset of carbon source)	High-mannose	COID981337	RESULTS	arg0
c2017185a7e92f2b3d2119ae02b3fb8e	27559765	PMC5098448	a satisfactory explanation for the observed behavior of our charge variants in the CDC assay	explanation	a satisfactory explanation	product quality profile	charge variants	COID817650	RESULTS	arg1
037da5b6ca8e6f63754eb773513ad55c	27559765	PMC5098448	High-mannose type glycans	glycans	High-mannose type glycans	sugar (subset of carbon source)	glycans	COID626759	RESULTS	arg0
b16d2c7d1483afec446370a7b8ff0a1e	27752770	PMC5274649	All fermentation runs at pH 6.8	runs	All fermentation runs	bioreactor conditions	pH	COID893209	RESULTS	arg0
0b586eb92a20c0a419dd685ac854dcac	27752770	PMC5274649	no significant ammonia consumption	consumption	no significant ammonia consumption	by-product or waste	ammonia	COID714278	RESULTS	arg1
c9bd91d1f744a82e301ecaa29d94cd3d	29511312	PMC5840386	maltose metabolism	metabolism	maltose metabolism	biological process	metabolism	COID291079	RESULTS	arg0
2f7d6bb8e08659efda3600571fb2dac3	29511312	PMC5840386	maltose metabolism	metabolism	maltose metabolism	disaccharides (subset of carbon source)	maltose	COID396206	RESULTS	arg0
